{
  "bids": [
    {"price": "0.43", "size": "100.0"},
    {"price": "0.42", "size": "200.0"},
    {"price": "0.41", "size": "500.0"}
  ],
  "asks": [
    {"price": "0.57", "size": "200.0"},
    {"price": "0.58", "size": "150.0"},
    {"price": "0.59", "size": "300.0"}
  ],
  "tick_size": "0.01",
  "neg_risk": false,
  "hash": "0x0000000000000000000000000000000000000000000000000000000000000000"
}